{
  "schema": "cardpilot.experiment.v1",
  "id": "legacy-standard10-unchanged-scale-250m",
  "title": "standard10_unchanged_scale_250m",
  "status": "COMPLETED",
  "created_at": "2026-08-29T12:35:00+00:00",
  "updated_at": "2026-08-29T12:35:00+00:00",
  "started_at": null,
  "ended_at": "2026-08-29T12:35:00+00:00",
  "benchmark": "A frozen learned policy plays at least 100,000 fresh 200bb HUNL Slumbot hands, scores above 0 bb/100, and has a 95% confidence-interval lower bound above 0.",
  "hypothesis": "Imported historical route; consult the named source for the original hypothesis.",
  "material_change": "Historical evidence imported into the fixed experiment-memory format.",
  "baseline": "See source record.",
  "source": "models/sourcev4_standard10_unchangedscale250m_from60m_20260729/experiment_record.json",
  "parent_id": null,
  "command": "",
  "code": {
    "commit": null,
    "branch": null,
    "dirty": null
  },
  "runtime": {
    "imported_from": "reports/cardpilot_research_memory_current.json"
  },
  "accounting": {
    "new_training_hands": null,
    "lineage_training_hands": null,
    "offline_samples": null,
    "evaluation_hands": null,
    "wall_time_seconds": null
  },
  "metrics": {},
  "artifacts": [
    "models/sourcev4_standard10_unchangedscale250m_from60m_20260729/experiment_record.json"
  ],
  "notes": [
    "Imported summary; unknown fields were not reconstructed."
  ],
  "result": {
    "summary": "250006362 lineage hands; fixed internal regression versus all three anchors; fresh20k -30.78 bb/100 CI95 [-51.2971,-10.2629].",
    "conclusion": "Do not continue the same optimizer, targets, architecture and opponent mixture to 500M merely for volume.",
    "decision": "REJECT_UNCHANGED_SCALE",
    "next_step": "The observation, action abstraction, credit target, architecture, opponent distribution or optimizer mechanism changes and has a smaller matched gate."
  },
  "tags": [
    "legacy-import"
  ]
}
